{"schema": "vault-buddy-workspace/1", "project": {"schema": "vault-buddy-video-project/3", "id": "verified-workspace", "title": "Workspace roundtrip test", "canvas": {"width": 1280, "height": 720, "fps": 30}, "master_gain": 0.8, "assets": [{"id": "presenter", "kind": "video", "builtin": "presenter", "name": "Presenter \u00b7 demo", "duration_ms": 33500, "width": 1280, "height": 720}, {"id": "screen", "kind": "video", "builtin": "screen", "name": "Getting started.capture", "duration_ms": 36000, "width": 1280, "height": 720}, {"id": "detail", "kind": "video", "builtin": "detail", "name": "Project detail.capture", "duration_ms": 18000, "width": 1280, "height": 720}, {"id": "cues", "kind": "audio", "builtin": "cues", "name": "Guide cues \u00b7 synthesized", "duration_ms": 36000}, {"id": "ambient", "kind": "audio", "builtin": "ambient", "name": "Ambient bed \u00b7 synthesized", "duration_ms": 36000}, {"id": "asset-mu8gj5il-g", "name": "capture-with-audio.mp4", "original_name": "capture-with-audio.mp4", "size": 1511737, "last_modified": 1789824564298, "kind": "video", "duration_ms": 6000, "width": 640, "height": 360}, {"id": "asset-mu8gj5nz-h", "name": "narration-tone.wav", "original_name": "narration-tone.wav", "size": 576078, "last_modified": 1789824564303, "kind": "audio", "duration_ms": 6000, "width": 0, "height": 0}], "tracks": [{"id": "v3", "kind": "video", "name": "Webcam \u00b7 presenter", "visible": true, "muted": false, "solo": false, "locked": false, "volume": 1}, {"id": "v1", "kind": "video", "name": "Screen recording", "visible": true, "muted": false, "solo": false, "locked": false, "volume": 1}, {"id": "a1", "kind": "audio", "name": "Guide cues", "visible": true, "muted": false, "solo": false, "locked": false, "volume": 1}], "clips": [{"id": "rmain", "asset_id": "asset-mu8gj5il-g", "track_id": "v1", "name": "Screen recording", "start_ms": 0, "in_ms": 0, "out_ms": 2600, "fade_in_ms": 300, "fade_out_ms": 300, "fade_curve": "smooth", "opacity": 1, "volume": 1, "muted": false, "x": 0, "y": 0, "w": 1, "h": 1}, {"id": "rpip", "asset_id": "asset-mu8gj5il-g", "track_id": "v3", "name": "Presenter overlay", "start_ms": 200, "in_ms": 0, "out_ms": 2400, "fade_in_ms": 300, "fade_out_ms": 300, "fade_curve": "smooth", "opacity": 0.6, "volume": 1, "muted": true, "x": 0.72, "y": 0.1, "w": 0.2, "h": 0.35555555555555557, "frame_shape": "circle", "fit": "cover"}, {"id": "rsound", "asset_id": "asset-mu8gj5nz-h", "track_id": "a1", "name": "Narration test tone", "start_ms": 0, "in_ms": 0, "out_ms": 2600, "fade_in_ms": 200, "fade_out_ms": 400, "fade_curve": "equal-power", "opacity": 1, "volume": 0.25, "muted": false, "x": 0, "y": 0, "w": 1, "h": 1}], "effects": [{"id": "rtext", "clip_id": "rmain", "kind": "text", "start_ms": 0, "end_ms": 2600, "x": 0.2, "y": 0.8, "w": 0.65, "h": 0.08, "color": "#ffffff", "background": true, "fontSize": 32, "text": "Two video layers. Two mixed audio sources."}], "markers": [], "transitions": [], "destination": {"vault": "Product knowledge", "folder": "Intake/Screen", "dated": false}}, "workspace": {"selection_clip_ids": ["rpip"], "caption_settings_open": false, "playhead_ms": 1000, "selected": {"type": "clip", "id": "rpip"}, "library_tab": "project", "property_tab": "layout", "timeline_zoom": 2, "timeline_height": 335, "timeline_scroll_left": 0, "timeline_scroll_top": 0, "snap": true, "delete_mode": "gap", "monitor_muted": true, "playback_rate": 1, "library_hidden": false, "properties_hidden": false, "properties_open": false, "focus_preview": false}, "record": {"id": "verified-workspace", "revision": 4, "created_at": "2026-09-19T14:02:57.700Z", "updated_at": "2026-09-19T14:03:12.863Z", "products": [{"id": "product-mu8gjfqo-i", "project_id": "verified-workspace", "name": "Workspace roundtrip test \u00b7 Review 1", "revision": 1, "created_at": "2026-09-19T14:03:10.320Z", "edit_fingerprint": "crc32:abe23147:2681", "duration_ms": 2600, "render_range": {"start_ms": 0, "end_ms": 2600}, "mime": "video/webm;codecs=vp9,opus", "filename": "Workspace roundtrip test-r1-jfqo-i.webm", "profile": "browser-review-1280x720-30fps", "snapshot": {"schema": "vault-buddy-video-project/3", "id": "verified-workspace", "title": "Workspace roundtrip test", "canvas": {"width": 1280, "height": 720, "fps": 30}, "master_gain": 0.8, "assets": [{"id": "presenter", "kind": "video", "builtin": "presenter", "name": "Presenter \u00b7 demo", "duration_ms": 33500, "width": 1280, "height": 720}, {"id": "screen", "kind": "video", "builtin": "screen", "name": "Getting started.capture", "duration_ms": 36000, "width": 1280, "height": 720}, {"id": "detail", "kind": "video", "builtin": "detail", "name": "Project detail.capture", "duration_ms": 18000, "width": 1280, "height": 720}, {"id": "cues", "kind": "audio", "builtin": "cues", "name": "Guide cues \u00b7 synthesized", "duration_ms": 36000}, {"id": "ambient", "kind": "audio", "builtin": "ambient", "name": "Ambient bed \u00b7 synthesized", "duration_ms": 36000}, {"id": "asset-mu8gj5il-g", "name": "capture-with-audio.mp4", "original_name": "capture-with-audio.mp4", "size": 1511737, "last_modified": 1789824564298, "kind": "video", "duration_ms": 6000, "width": 640, "height": 360}, {"id": "asset-mu8gj5nz-h", "name": "narration-tone.wav", "original_name": "narration-tone.wav", "size": 576078, "last_modified": 1789824564303, "kind": "audio", "duration_ms": 6000, "width": 0, "height": 0}], "tracks": [{"id": "v3", "kind": "video", "name": "Webcam \u00b7 presenter", "visible": true, "muted": false, "solo": false, "locked": false, "volume": 1}, {"id": "v1", "kind": "video", "name": "Screen recording", "visible": true, "muted": false, "solo": false, "locked": false, "volume": 1}, {"id": "a1", "kind": "audio", "name": "Guide cues", "visible": true, "muted": false, "solo": false, "locked": false, "volume": 1}], "clips": [{"id": "rmain", "asset_id": "asset-mu8gj5il-g", "track_id": "v1", "name": "Screen recording", "start_ms": 0, "in_ms": 0, "out_ms": 2600, "fade_in_ms": 300, "fade_out_ms": 300, "fade_curve": "smooth", "opacity": 1, "volume": 1, "muted": false, "x": 0, "y": 0, "w": 1, "h": 1}, {"id": "rpip", "asset_id": "asset-mu8gj5il-g", "track_id": "v3", "name": "Presenter overlay", "start_ms": 200, "in_ms": 0, "out_ms": 2400, "fade_in_ms": 300, "fade_out_ms": 300, "fade_curve": "smooth", "opacity": 1, "volume": 1, "muted": true, "x": 0.72, "y": 0.1, "w": 0.2, "h": 0.35555555555555557, "frame_shape": "circle", "fit": "cover"}, {"id": "rsound", "asset_id": "asset-mu8gj5nz-h", "track_id": "a1", "name": "Narration test tone", "start_ms": 0, "in_ms": 0, "out_ms": 2600, "fade_in_ms": 200, "fade_out_ms": 400, "fade_curve": "equal-power", "opacity": 1, "volume": 0.25, "muted": false, "x": 0, "y": 0, "w": 1, "h": 1}], "effects": [{"id": "rtext", "clip_id": "rmain", "kind": "text", "start_ms": 0, "end_ms": 2600, "x": 0.2, "y": 0.8, "w": 0.65, "h": 0.08, "color": "#ffffff", "background": true, "fontSize": 32, "text": "Two video layers. Two mixed audio sources."}], "markers": [], "transitions": [], "destination": {"vault": "Product knowledge", "folder": "Intake/Screen", "dated": false}}}]}, "saved_at": "2026-09-19T14:03:13.980Z"}